{
  "source_domain": {
    "name": "Máquina caça-níquel de cassino",
    "elements": [
      "Alavanca que você puxa — ação simples, repetível, sem esforço cognitivo",
      "Prêmio incerto — pode dar nada, pode dar pouco, pode dar muito",
      "Som e luz pra cada giro — feedback sensorial mesmo quando perde",
      "Quase-ganho desenhado pelo design: 2 cerejas + 1 limão se repete demais por engenharia",
      "Você sai dizendo 'só mais uma' — porque o cérebro nunca terminou de processar a chance"
    ]
  },
  "target_domain": {
    "name": "Feed infinito do celular",
    "elements": [
      "Deslizar pra baixo — gesto curto, repetível, automático",
      "Conteúdo incerto — pode ser tédio, pode ser meme bom, pode ser vídeo viciante",
      "Vibração e notificação a cada novidade — feedback mesmo no scroll vazio",
      "Quase-relevante: vídeo 'só meio interessante' aparece de propósito pra você continuar",
      "Você fecha dizendo 'só mais 5 minutos' — pelos mesmos motivos do cassino"
    ]
  },
  "mapping": [
    {
      "from": "Puxar a alavanca da máquina",
      "to": "Deslizar pra baixo no feed"
    },
    {
      "from": "Prêmio incerto a cada giro",
      "to": "Conteúdo incerto a cada deslize"
    },
    {
      "from": "Luz e som de quase-ganho",
      "to": "Vídeo 'meio bom' que segura mais um deslize"
    },
    {
      "from": "Cassino ganha quanto mais tempo você joga",
      "to": "App ganha quanto mais tempo você fica"
    }
  ],
  "transfer_question": "Se você não jogaria caça-níquel 144 vezes por dia, por que faz o gesto equivalente no celular sem perceber?"
}
