{
  "source_domain": {
    "name": "Carro com dois motores: elétrico e a combustão",
    "elements": [
      "Elétrico arranca rápido, gasta pouco, ideal pra trânsito do dia",
      "Combustão é mais forte, mais lento pra ligar, ideal pra subida pesada",
      "Sistema decide qual usar — geralmente escolhe o elétrico (é mais barato)",
      "Em subida íngreme, se ficar só no elétrico, falha e atola",
      "Bom motorista sabe quando forçar o sistema a chamar o motor maior"
    ]
  },
  "target_domain": {
    "name": "Seu cérebro com dois sistemas: rápido e devagar",
    "elements": [
      "Rápido (S1) reage em segundos, gasta pouca energia, ideal pra rotina",
      "Devagar (S2) é mais preciso, exige esforço, ideal pra decisão complicada",
      "Cérebro escolhe o S1 quase sempre — é mais barato",
      "Em decisão importante, se ficar só no S1, erra e estraga",
      "Treino é saber quando forçar o cérebro a ligar o S2"
    ]
  },
  "mapping": [
    {
      "from": "Motor elétrico, leve e padrão",
      "to": "Sistema 1, rápido e automático"
    },
    {
      "from": "Motor a combustão, forte e lento",
      "to": "Sistema 2, lento e analítico"
    },
    {
      "from": "Carro sempre prefere o motor barato",
      "to": "Cérebro sempre prefere o sistema barato"
    },
    {
      "from": "Motorista força o motor pesado em subida",
      "to": "Você força o S2 em decisão pesada"
    }
  ],
  "transfer_question": "Se um motorista que só usa elétrico atola em subida, em que momentos você 'atola' por não ter ligado o sistema 2 a tempo?"
}
