{
  "source_domain": {
    "name": "Advogado de defesa em um julgamento",
    "elements": [
      "Já chegou no tribunal com o cliente decidido como inocente",
      "Procura nas provas só o que ajuda a tese — descarta o resto como 'irrelevante'",
      "Quando uma testemunha contradiz, busca um detalhe pra desacreditar",
      "Não está tentando achar a verdade — está tentando vencer a causa",
      "No final, está sinceramente convencido de que mostrou a 'verdade'"
    ]
  },
  "target_domain": {
    "name": "Seu cérebro defendendo uma opinião que você já tem",
    "elements": [
      "Já chega no Google com a conclusão pronta — só falta a frase pra repetir",
      "Lê o post que concorda e fecha o que discorda em 4 segundos",
      "Quando alguém contesta, encontra um detalhe nele pra desclassificar a pessoa",
      "Não está investigando — está catando munição",
      "Sai da rolagem com a sensação de que 'pesquisou' o tema"
    ]
  },
  "mapping": [
    {
      "from": "Advogado entra decidido a defender o cliente",
      "to": "Cérebro entra decidido a defender a opinião"
    },
    {
      "from": "Filtra as provas a favor, descarta as contra",
      "to": "Filtra os argumentos a favor, descarta os contra"
    },
    {
      "from": "Sente que ganhou porque achou a 'verdade'",
      "to": "Sente que pesquisou porque achou texto concordando"
    },
    {
      "from": "Promotor existe pra forçar contradição",
      "to": "Conversa com alguém que discorda força contradição"
    }
  ],
  "transfer_question": "Se você nunca contrataria um advogado pra fazer 'pesquisa imparcial' sobre um caso, por que confia no seu próprio cérebro nessa função?"
}
