{
  "source_domain": {
    "name": "Tentar somar usando letras do alfabeto",
    "elements": [
      "Imagina contar bolinhas usando letras: A=1, B=2, C=3, D=4, E=5...",
      "Pra somar 'C + B', vira 'CB' — ninguém sabe se é 32 ou 5",
      "Não dá pra empilhar pra somar em coluna, não tem casa decimal",
      "Multiplicar fica impossível: quanto é 'EJ × C'?",
      "O sistema funciona pra anotar pequeno, mas trava pra contas grandes"
    ]
  },
  "target_domain": {
    "name": "Sistema de numeração romano",
    "elements": [
      "Romanos somavam letras: I=1, V=5, X=10, L=50, C=100, D=500, M=1000",
      "Escrever 358 ficava CCCLVIII, e 47 ficava XLVII",
      "Não havia zero, nem casa decimal, nem o conceito de coluna",
      "Tentar multiplicar 358 × 47 era praticamente impossível em romano",
      "Por isso a matemática romana ficou parada por séculos"
    ]
  },
  "mapping": [
    {
      "from": "Letra = número escondido",
      "to": "Letra romana = número escondido"
    },
    {
      "from": "Sem zero, conta de coluna não existe",
      "to": "Sem zero, conta de coluna romana não existe"
    },
    {
      "from": "Multiplicar letra é praticamente impossível",
      "to": "Multiplicar em romano é praticamente impossível"
    },
    {
      "from": "Sistema trava pro avanço da matemática",
      "to": "Sistema romano travou o avanço da matemática"
    }
  ],
  "transfer_question": "Se Roma era um império tão poderoso, como pode a matemática deles ter sido travada por algo tão simples como 'falta de zero'?"
}
