{
  "source_domain": {
    "name": "Plantar manga ou comprar suco no mercado",
    "elements": [
      "Suco no mercado: prazer em 10 minutos, R$ 8, fica na geladeira 3 dias",
      "Plantar manga: precisa de muda, água, tempo — sai fruta em 4 anos",
      "Quem só toma suco nunca conhece o gosto da manga do próprio quintal",
      "Quem planta manga não vê resultado no primeiro ano, nem no segundo",
      "No ano 5: o do suco gastou R$ 5.000, o da manga colhe 80 frutas por safra"
    ]
  },
  "target_domain": {
    "name": "Aprender uma habilidade vs consumir conteúdo pronto",
    "elements": [
      "Vídeo pronto: prazer em 10 min, te entretém, esquece em 3 dias",
      "Aprender a fazer: precisa de prática, erro, repetição — sai resultado em meses",
      "Quem só consome nunca conhece a habilidade de produzir",
      "Quem aprende não vê resultado na primeira semana, nem no primeiro mês",
      "No ano 1: o consumidor viu 500 vídeos, o aprendiz tem uma habilidade"
    ]
  },
  "mapping": [
    {
      "from": "Suco do mercado, prazer rápido",
      "to": "Conteúdo consumido, prazer rápido"
    },
    {
      "from": "Plantar manga, demora 4 anos",
      "to": "Aprender, demora meses"
    },
    {
      "from": "Colheita anual depois da espera",
      "to": "Habilidade que rende a vida toda depois"
    },
    {
      "from": "Quem só toma suco gasta sem acumular",
      "to": "Quem só consome gasta tempo sem acumular"
    }
  ],
  "transfer_question": "Se em 5 anos o pé de manga dá fruta de graça enquanto R$ 5.000 do suco viraram fralda, por que sua semana de estudo gira no que dá prazer hoje?"
}
