{
  "source_domain": {
    "name": "Galo que canta toda madrugada na chácara",
    "elements": [
      "O galo manda o sinal: 'amanheceu, hora de levantar'",
      "Galinhas, vacas, gente — todo mundo do sítio responde ao canto",
      "Se você toca uma gravação de galo às 4h, o gado também acorda confuso",
      "O canto é um aviso interno do dia começando",
      "Sem o canto, o sítio acorda no horário natural do sol — devagar"
    ]
  },
  "target_domain": {
    "name": "Luz da tela do celular antes de dormir",
    "elements": [
      "A luz azul manda o sinal: 'amanheceu, hora de ficar acordado'",
      "Cérebro segura a melatonina — o hormônio do sono",
      "Se você usa o celular 22h, o cérebro 'acorda' fora de hora, confuso",
      "A luz é um aviso interno do dia começando",
      "Sem a luz, o cérebro libera melatonina no horário natural — bate o sono fácil"
    ]
  },
  "mapping": [
    {
      "from": "Canto do galo sinalizando manhã",
      "to": "Luz azul sinalizando manhã"
    },
    {
      "from": "Gravação confunde o gado de madrugada",
      "to": "Celular confunde o cérebro à noite"
    },
    {
      "from": "Sítio sem galo acorda no ritmo do sol",
      "to": "Cérebro sem tela dorme no ritmo do sol"
    },
    {
      "from": "Animal não escolhe ignorar o canto",
      "to": "Cérebro não escolhe ignorar a luz"
    }
  ],
  "transfer_question": "Se você não tocaria som de galo dentro do quarto às 23h, por que liga uma tela que faz a mesma coisa pro seu cérebro?"
}
