{
  "source_domain": {
    "name": "Médico investigando dor de cabeça crônica",
    "elements": [
      "Paciente reclama: 'doutor, dói minha cabeça toda tarde'",
      "Médico ruim: 'toma esse remédio pra dor' — alivia, mas volta amanhã",
      "Médico bom: 'por quê?' — descobre que é depois do almoço",
      "Pergunta de novo: 'por quê?' — descobre que é depois do café forte",
      "Pergunta mais 3 vezes — chega em: 'porque você toma café com estômago vazio'"
    ]
  },
  "target_domain": {
    "name": "Você investigando 'por que tirei nota baixa de novo'",
    "elements": [
      "Você fala: 'tirei 4 na prova'",
      "Resposta ruim: 'vou estudar mais' — alivia a vergonha, mas se repete",
      "Pergunta 1: 'por quê tirei 4?' — porque não soube 6 das 10 questões",
      "Pergunta 2: 'por quê não soube?' — porque não revisei a matéria do dia",
      "Pergunta 3, 4, 5 — chega em: 'porque deixei o celular do lado da mesa de estudo'"
    ]
  },
  "mapping": [
    {
      "from": "Sintoma da dor de cabeça",
      "to": "Nota baixa que apareceu"
    },
    {
      "from": "Remédio de alívio sem investigar",
      "to": "'Vou me esforçar mais' sem investigar"
    },
    {
      "from": "Cada 'por quê' desce uma camada",
      "to": "Cada 'por quê' desce uma camada da causa"
    },
    {
      "from": "Causa raiz revela o ajuste real",
      "to": "Causa raiz revela o que mudar"
    }
  ],
  "transfer_question": "Se o médico que para no primeiro 'por quê' nunca cura o paciente, por que você espera resolver problema repetindo só 'vou me esforçar mais'?"
}
