{
  "source_domain": {
    "name": "Bola de gude jogada num corredor de bolinhas",
    "elements": [
      "Você joga uma bola grande no meio de bolinhas pequenas espalhadas",
      "A bola grande passa quase reta, mal desvia das pequenas",
      "Uma bola pequena bate em todas e ricocheteia pra tudo quanto é canto",
      "Quem olha de longe vê o corredor cheio das ricocheteadas, não da reta",
      "Bola pequena demais escapa pelo vão sem bater em ninguém"
    ]
  },
  "target_domain": {
    "name": "Luz do sol batendo no ar",
    "elements": [
      "Luz branca traz todas as cores misturadas no mesmo feixe",
      "Vermelho tem onda 'grande', passa quase reta pelo ar",
      "Azul tem onda 'pequena', bate nas moléculas e espalha pra tudo lado",
      "Você olha pro céu e vê o azul espalhado, não a luz reta",
      "Raio ultravioleta é tão pequeno que muitos escapam pela atmosfera"
    ]
  },
  "mapping": [
    {
      "from": "Bola grande passa reta no corredor",
      "to": "Luz vermelha passa reta pelo ar"
    },
    {
      "from": "Bola pequena ricocheteia em todas direções",
      "to": "Luz azul espalha em todas direções"
    },
    {
      "from": "De longe se vê o ricochete, não a reta",
      "to": "De baixo se vê o azul espalhado, não o feixe reto"
    },
    {
      "from": "Tamanho da bola decide se desvia ou não",
      "to": "Tamanho da onda decide qual cor espalha"
    }
  ],
  "transfer_question": "Se o sol manda todas as cores juntas, qual seria a cor do céu num planeta com ar feito de moléculas bem maiores que as do nosso?"
}
