{
  "source_domain": {
    "name": "Cozinha enquanto a panela de pressão cozinha o feijão",
    "elements": [
      "A pressão sobe quando a tampa fica fechada por tempo suficiente",
      "Se abrir antes da hora pra 'ver se tá pronto', a pressão escapa toda",
      "O cozinheiro sabe: pressão dentro é o que faz o feijão amaciar",
      "Tirar a tampa toda hora não acelera — só estraga",
      "A pressão só faz seu trabalho se ninguém interromper"
    ]
  },
  "target_domain": {
    "name": "Ideia criativa cozinhando no cérebro sem tela",
    "elements": [
      "Conexões formam quando a mente fica em ócio por tempo suficiente",
      "Se pegar o celular pra 'ver uma coisa rápida', a conexão se desfaz",
      "Pesquisador sabe: tédio é o que faz a ideia amadurecer",
      "Quebrar o ócio toda hora não acelera — só impede",
      "A criatividade só faz seu trabalho se ninguém interromper"
    ]
  },
  "mapping": [
    {
      "from": "Pressão acumulada dentro da panela",
      "to": "Ideias acumulando em segundo plano"
    },
    {
      "from": "Abrir a tampa cedo libera a pressão",
      "to": "Pegar o celular libera a conexão"
    },
    {
      "from": "Cozinheiro paciente é quem come feijão amaciado",
      "to": "Quem aguenta o tédio é quem tem ideia boa"
    },
    {
      "from": "Tempo fechado é a coisa toda",
      "to": "Tempo sem tela é a coisa toda"
    }
  ],
  "transfer_question": "Se você não abriria a panela de pressão 5 vezes pra ver se o feijão tá pronto, por que abre o celular 5 vezes quando começa a se entediar?"
}
