{
  "source_domain": {
    "name": "Mudar de casa carregando os móveis",
    "elements": [
      "Olhar pra casa inteira e pensar 'preciso mudar tudo' paralisa",
      "Cada cômodo separado vira uma tarefa do tamanho de uma tarde",
      "Cada cômodo se divide em: caixas → móveis grandes → carro → caixas no destino",
      "Caixa por caixa é trabalho real; 'a mudança' é abstração",
      "No fim, a casa tá vazia — feito por 200 ações pequenas, nenhuma heroica"
    ]
  },
  "target_domain": {
    "name": "Estudar pra prova de 6 matérias daqui a 3 semanas",
    "elements": [
      "Olhar pra 'a prova final' e pensar 'preciso estudar tudo' paralisa",
      "Cada matéria separada vira algo do tamanho de uma tarde",
      "Cada matéria se divide em: ler resumo → fazer 5 exercícios → revisar errados → marcar dúvida",
      "Exercício por exercício é trabalho real; 'estudar' é abstração",
      "No fim, você tá pronto — feito por 80 ações pequenas, nenhuma heroica"
    ]
  },
  "mapping": [
    {
      "from": "'A mudança' como ideia gigante",
      "to": "'A prova' como ideia gigante"
    },
    {
      "from": "Cômodo é a primeira quebra útil",
      "to": "Matéria é a primeira quebra útil"
    },
    {
      "from": "Caixa é a unidade de execução",
      "to": "Exercício é a unidade de execução"
    },
    {
      "from": "Soma das caixas = casa pronta",
      "to": "Soma dos exercícios = matéria sabida"
    }
  ],
  "transfer_question": "Por que tantas pessoas que 'mudariam de casa caixa por caixa' tentam 'estudar matéria toda de uma vez'?"
}
