{
  "source_domain": {
    "name": "Sirene de almoço de escola tocando todo dia ao meio-dia",
    "elements": [
      "Gatilho: sirene às 12h00",
      "Resposta automática: todo mundo sai pro refeitório",
      "Recompensa: comida, conversa com os amigos, descanso",
      "Em 3 semanas, ninguém mais precisa de relógio — o corpo sente fome perto das 12h",
      "Tira a sirene: o corpo continua chamando às 12h sozinho — virou hábito"
    ]
  },
  "target_domain": {
    "name": "Pegar o celular sempre que a aula fica chata",
    "elements": [
      "Gatilho: tédio na aula",
      "Resposta automática: mão na bolsa, celular na mão",
      "Recompensa: estímulo rápido, fuga do tédio",
      "Em 3 semanas, ninguém escolhe mais — o gatilho dispara a mão sozinha",
      "Tira a aula chata: o gatilho 'tédio' continua disparando — virou hábito"
    ]
  },
  "mapping": [
    {
      "from": "Sirene às 12h é o gatilho",
      "to": "Tédio é o gatilho"
    },
    {
      "from": "Andar até o refeitório é a resposta",
      "to": "Mão na bolsa é a resposta"
    },
    {
      "from": "Comida + amigos é a recompensa",
      "to": "Estímulo é a recompensa"
    },
    {
      "from": "3 semanas e o corpo sente fome às 12h",
      "to": "3 semanas e a mão pega celular sem você decidir"
    }
  ],
  "transfer_question": "Se a escola desligasse a sirene você ainda teria fome ao meio-dia — então por que esperar que 'apenas decidir parar de pegar o celular' funcione, quando o gatilho continua firme?"
}
